{
  "schema": "report-pipeline/preference-pack/figure_style-v1",
  "pack_type": "figure_style",
  "name": "neutral-default",
  "version": 1,
  "preset": "engineering",
  "background": "#ffffff",
  "spines": "box",
  "grid_color": "#d9d9d9",
  "tick_direction": "out",
  "color_cycle": ["#0072BD", "#D95319", "#EDB120", "#7E2F8E", "#77AC30"],
  "font_family": "sans-serif",
  "dpi": 300,
  "legend": {"frame": true, "placement": "best"},
  "colormap_whitelist": ["parula", "gray"],
  "banned_aesthetics": [],
  "caption_source_policy": "endnote"
}
